{
  "schemaVersion": "1.0.0",
  "readinessDecisionId": "readiness-decision-deploy-frontend-review",
  "planId": "ready-plan-deploy-frontend-review",
  "decision": "not-ready",
  "reason": "The modeled plan has dependency, preflight, rollback, and idempotency coverage, but approval-chain readiness is incomplete.",
  "blockingReasons": [
    "Required Phase 9 approval record is present but not approved."
  ],
  "evaluatedAt": "2026-06-05T18:04:00Z",
  "executionPermissionGranted": false,
  "readinessBoundary": {
    "executionEnabled": false,
    "providerCallsAllowed": false,
    "deploymentAllowed": false,
    "secretAccessAllowed": false
  }
}
